{
  "$schema": "../../../../docs/schemas/static-analysis-request.schema.json",
  "schemaVersion": 1,
  "compositionId": "reborn.zexpedition03.raynor-mvp",
  "analyzers": [
    { "toolId": "legacy-sc2-toolkit", "capability": "dependency-inspect" },
    { "toolId": "galaxy-toolkit", "capability": "galaxy-parse" }
  ],
  "coverage": ["dependencies", "catalog", "galaxy", "initializers", "triggers", "banks", "objectives", "rewards"],
  "output": {
    "dependencyGraph": "evidence/static/dependency-graph.json",
    "unresolved": "evidence/static/unresolved.json"
  }
}
